Term,Slug,Definition,URL,Keywords,Category
"Private AI","private-ai","Private AI is an artificial intelligence deployment model where models, data, and inference run entirely within an organization's controlled environment to ensure data sovereignty, security, and compliance.","https://agenixhub.com/definitions/private-ai","Private AI, private-ai, enterprise private AI, private LLM, on-prem inference","Enterprise AI Deployment"
"On-Premise AI","on-premise-ai","On-Premise AI refers to artificial intelligence systems deployed and operated within an organization's physical infrastructure rather than external cloud services.","https://agenixhub.com/definitions/on-premise-ai","On-Premise AI, on-prem AI, on-premise LLM, enterprise on-prem","Enterprise AI Deployment"
"Enterprise AI Copilot","enterprise-ai-copilot","An Enterprise AI Copilot is a secure, task-oriented AI system designed to assist employees using internal enterprise data, workflows, and permissions.","https://agenixhub.com/definitions/enterprise-ai-copilot","Enterprise AI Copilot, enterprise copilot, AI copilot, copilots for enterprise","Enterprise AI Applications"
"Enterprise RAG","enterprise-rag","Enterprise RAG (Retrieval-Augmented Generation) is an architecture that combines enterprise data retrieval systems with large language models to generate context-aware, grounded responses.","https://agenixhub.com/definitions/enterprise-rag","Enterprise RAG, retrieval augmented generation, enterprise retrieval, RAG for enterprise","AI Architecture"
"Secure AI Copilot","secure-ai-copilot","A Secure AI Copilot is an AI assistant designed with strict access controls, auditability, and data isolation to operate safely in regulated enterprise environments.","https://agenixhub.com/definitions/secure-ai-copilot","Secure AI Copilot, secure copilot, AI security, access controls AI","Enterprise AI Security"
"Data-Sovereign AI","data-sovereign-ai","Data-Sovereign AI describes AI systems that ensure data residency, ownership, and governance remain fully under the control of the data owner.","https://agenixhub.com/definitions/data-sovereign-ai","Data-Sovereign AI, data sovereignty, data residency, sovereign AI","Data Governance"
